{
  "$schema": "./schemas/dependencies-lock.schema.json",
  "schemaVersion": "1.0",
  "baselineVersion": "0.1.0",
  "generatedAt": "2026-10-12T00:00:00+08:00",
  "targetPlatform": "windows-x86_64",
  "dependencies": [
    {
      "id": "freecad",
      "name": "FreeCAD",
      "version": "1.1.3",
      "source": {
        "type": "official-release",
        "url": "https://github.com/FreeCAD/FreeCAD/releases/tag/1.1.3",
        "sha256": "9c6959dc9c4dba64dd818a62447e3dfedb4221d776fb044b239d462f150bcec4",
        "sizeBytes": null,
        "verificationStatus": "verified",
        "signature": "Upstream release digest matched; local archive is not retained in the source repository"
      },
      "capabilities": [
        "cad.gui",
        "cad.headless",
        "cad.python",
        "cad.export",
        "geometry.exact-check"
      ],
      "licenses": [
        {
          "name": "GNU Lesser General Public License v2.1 or later",
          "spdx": "LGPL-2.1-or-later",
          "status": "review-required",
          "source": "https://www.freecad.org/contributing.php"
        }
      ],
      "install": {
        "packId": "cad-pack",
        "mode": "extract",
        "entryPoints": {
          "gui": "FreeCAD.exe",
          "headless": "bin/FreeCADCmd.exe",
          "python": "bin/python.exe"
        }
      },
      "distributionStatus": "candidate",
      "blockers": [
        "Aggregate bundled third-party notices before redistribution"
      ],
      "healthCheck": {
        "type": "command",
        "target": "bin/FreeCADCmd.exe",
        "arguments": [
          "--version"
        ],
        "expected": "FreeCAD 1.1.3"
      }
    },
    {
      "id": "openmodelica",
      "name": "OpenModelica",
      "version": "1.27.1",
      "source": {
        "type": "official-release",
        "url": "https://openmodelica.org/download/download-windows/",
        "sha256": null,
        "sizeBytes": 1641758269,
        "verificationStatus": "pending-hash",
        "signature": "Local installer MD5 matched upstream and signature was valid; SHA-256 archive is not retained"
      },
      "capabilities": [
        "modelica.check",
        "modelica.compile",
        "modelica.simulate",
        "modelica.fmu-export",
        "fmi.run"
      ],
      "licenses": [
        {
          "name": "OSMC Public License with selected subsidiary mode",
          "spdx": null,
          "status": "review-required",
          "source": "https://openmodelica.org/free-and-open-source-software/full-license/"
        }
      ],
      "install": {
        "packId": "modelica-pack",
        "mode": "extract",
        "entryPoints": {
          "compiler": "bin/omc.exe",
          "simulator": "bin/OMSimulator.exe"
        }
      },
      "distributionStatus": "blocked",
      "blockers": [
        "Acquire official installer and record SHA-256",
        "Select and document OSMC-PL usage mode",
        "Publish an audited self-contained runtime using the P3 pack format",
        "Aggregate third-party compiler and runtime notices"
      ],
      "healthCheck": {
        "type": "command",
        "target": "bin/omc.exe",
        "arguments": [
          "--version"
        ],
        "expected": "OpenModelica v1.27.1"
      }
    },
    {
      "id": "python-runtime",
      "name": "AIDC managed Python runtime",
      "version": "3.12.9",
      "source": {
        "type": "official-release",
        "url": "https://www.python.org/downloads/release/python-3129/",
        "sha256": null,
        "sizeBytes": null,
        "verificationStatus": "pending-download",
        "signature": null
      },
      "capabilities": [
        "python.execute",
        "modelica.server",
        "modelica.generate",
        "geometry.service"
      ],
      "licenses": [
        {
          "name": "Python Software Foundation License 2.0",
          "spdx": "PSF-2.0",
          "status": "review-required",
          "source": "https://docs.python.org/3/license.html"
        }
      ],
      "install": {
        "packId": "python-pack",
        "mode": "extract",
        "entryPoints": {
          "python": "python.exe"
        }
      },
      "distributionStatus": "blocked",
      "blockers": [
        "Freeze Python wheel lock",
        "Publish an audited embeddable runtime using the P3 pack format",
        "Generate complete license inventory"
      ],
      "healthCheck": {
        "type": "command",
        "target": "python.exe",
        "arguments": [
          "--version"
        ],
        "expected": "Python 3.12.9"
      }
    },
    {
      "id": "sysml-parser-runtime",
      "name": "AIDC SysML Parser Runtime",
      "version": "1.0.0",
      "source": {
        "type": "internal-build",
        "url": null,
        "sha256": null,
        "sizeBytes": null,
        "verificationStatus": "pending-build",
        "signature": "Standalone implementation is built from source in this repository; release digest is generated during publishing"
      },
      "capabilities": [
        "sysml.parse",
        "sysml.analyze",
        "sysml.snapshot",
        "sysml.view"
      ],
      "licenses": [
        {
          "name": "AIDC project license decision pending",
          "spdx": null,
          "status": "review-required",
          "source": "distribution/licenses/THIRD_PARTY_BASELINE.md"
        }
      ],
      "install": {
        "packId": "core",
        "mode": "internal",
        "entryPoints": {
          "runtime": "bin/aidc-sysml-parser-runtime.exe"
        }
      },
      "distributionStatus": "blocked",
      "blockers": [
        "Select and publish the AIDC project license",
        "Sign release executable"
      ],
      "healthCheck": {
        "type": "http",
        "target": "/health",
        "arguments": [],
        "expected": "HTTP 200, runtimeVersion 1.0.0 and qtDependency false"
      }
    },
    {
      "id": "sysml-standard-library",
      "name": "SysML v2 Standard Library",
      "version": "2026-08",
      "source": {
        "type": "official-release",
        "url": "https://github.com/Systems-Modeling/SysML-v2-Release/releases/tag/2026-08",
        "sha256": "22b203a3f2bfa35ff272ed57702d154aed8966ea0978c44ceca6658f2c60bc51",
        "sizeBytes": 14474,
        "verificationStatus": "verified",
        "signature": "Hash refers to the checked-in LICENSE file; release archive hash remains pending"
      },
      "capabilities": [
        "sysml.library",
        "kerml.library"
      ],
      "licenses": [
        {
          "name": "Eclipse Public License 2.0",
          "spdx": "EPL-2.0",
          "status": "approved",
          "source": "https://github.com/Systems-Modeling/SysML-v2-Release/blob/master/LICENSE"
        }
      ],
      "install": {
        "packId": "core",
        "mode": "extract",
        "entryPoints": {
          "library": "library/sysml.library"
        }
      },
      "distributionStatus": "candidate",
      "blockers": [
        "Record release archive SHA-256 instead of only LICENSE hash"
      ],
      "healthCheck": {
        "type": "file",
        "target": "library/sysml.library/Base.kerml",
        "arguments": [],
        "expected": "file exists"
      }
    }
  ]
}
